{
  "version": 1,
  "name": "sound-style-demo-halloween",
  "sources": {
    "halloween-ambient-night": {
      "type": "single",
      "url": "/audio-halloween/halloween-ambient-night.mp3",
      "loop": true,
      "streaming": true
    },
    "halloween-ambient-alt": {
      "type": "single",
      "url": "/audio-halloween/halloween-ambient-alt.mp3",
      "loop": true,
      "streaming": true
    },
    "poi-category-sfx/cemetery": {
      "type": "single",
      "url": "/audio-halloween/cemetery.mp3"
    },
    "poi-category-sfx/dog-park": {
      "type": "single",
      "url": "/audio-halloween/dog-park.mp3"
    },
    "poi-category-sfx/crow": {
      "type": "single",
      "url": "/audio-halloween/crow.mp3"
    },
    "poi-category-sfx/zoo": {
      "type": "single",
      "url": "/audio-halloween/zoo.mp3"
    },
    "poi-category-sfx/aquarium": {
      "type": "single",
      "url": "/audio-halloween/aquarium.mp3"
    },
    "poi-category-sfx/veterinary": {
      "type": "single",
      "url": "/audio-halloween/veterinary.mp3"
    },
    "poi-category-sfx/horse-riding": {
      "type": "single",
      "url": "/audio-halloween/horse-riding.mp3"
    },
    "poi-category-sfx/racetrack-horse": {
      "type": "single",
      "url": "/audio-halloween/racetrack-horse.mp3"
    },
    "poi-category-sfx/haunted-mansion": {
      "type": "single",
      "url": "/audio-halloween/haunted-mansion.mp3"
    },
    "poi-category-sfx/witch-shop": {
      "type": "single",
      "url": "/audio-halloween/witch-shop.mp3"
    },
    "poi-category-sfx/shop": {
      "type": "single",
      "url": "/audio-halloween/shop.mp3"
    },
    "poi-category-sfx/restaurant": {
      "type": "single",
      "url": "/audio-halloween/restaurant.mp3"
    },
    "poi-category-sfx/bar": {
      "type": "single",
      "url": "/audio-halloween/bar.mp3"
    },
    "poi-category-sfx/alcohol-shop": {
      "type": "single",
      "url": "/audio-halloween/alcohol-shop.mp3"
    },
    "poi-category-sfx/car": {
      "type": "single",
      "url": "/audio-halloween/car.mp3"
    },
    "poi-category-sfx/car-repair": {
      "type": "single",
      "url": "/audio-halloween/car-repair.mp3"
    },
    "poi-category-sfx/car-wash": {
      "type": "single",
      "url": "/audio-halloween/car-wash.mp3"
    },
    "poi-category-sfx/woman-scream": {
      "type": "single",
      "url": "/audio-halloween/woman-scream.mp3"
    },
    "poi-category-sfx/highway": {
      "type": "single",
      "url": "/audio-halloween/highway.mp3"
    },
    "poi-category-sfx/parking": {
      "type": "single",
      "url": "/audio-halloween/parking.mp3"
    },
    "poi-category-sfx/bicycle": {
      "type": "single",
      "url": "/audio-halloween/bicycle.mp3"
    },
    "poi-category-sfx/laundry": {
      "type": "single",
      "url": "/audio-halloween/laundry.mp3"
    },
    "poi-category-sfx/industry": {
      "type": "single",
      "url": "/audio-halloween/industry.mp3"
    },
    "poi-category-sfx/church-bells": {
      "type": "single",
      "url": "/audio-halloween/church-bells.mp3"
    },
    "poi-category-sfx/scary-eerie-voice": {
      "type": "single",
      "url": "/audio-halloween/scary-eerie-voice.mp3"
    },
    "poi-category-sfx/monument": {
      "type": "single",
      "url": "/audio-halloween/ghost-girl.mp3"
    },
    "poi-category-sfx/info-booth": {
      "type": "single",
      "url": "/audio-halloween/crying-woman.mp3"
    },
    "poi-category-sfx/fitness-centre": {
      "type": "single",
      "url": "/audio-halloween/fitness-centre.mp3"
    },
    "poi-category-sfx/lodging": {
      "type": "single",
      "url": "/audio-halloween/lodging.mp3"
    },
    "poi-category-sfx/casino": {
      "type": "single",
      "url": "/audio-halloween/casino.mp3"
    },
    "poi-category-sfx/bowling-alley": {
      "type": "single",
      "url": "/audio-halloween/bowling-alley.mp3"
    },
    "poi-category-sfx/baseball": {
      "type": "single",
      "url": "/audio-halloween/baseball.mp3"
    },
    "poi-category-sfx/basketball": {
      "type": "single",
      "url": "/audio-halloween/basketball.mp3"
    },
    "poi-category-sfx/library": {
      "type": "single",
      "url": "/audio-halloween/library.mp3"
    },
    "poi-category-sfx/viewpoint": {
      "type": "single",
      "url": "/audio-halloween/viewpoint.mp3"
    },
    "poi-category-sfx/school": {
      "type": "single",
      "url": "/audio-halloween/school.mp3"
    },
    "poi-category-sfx/museum": {
      "type": "single",
      "url": "/audio-halloween/museum.mp3"
    },
    "poi-category-sfx/harbor": {
      "type": "single",
      "url": "/audio-halloween/harbor.mp3"
    },
    "poi-category-sfx/fire-station": {
      "type": "single",
      "url": "/audio-halloween/fire-station.mp3"
    },
    "poi-category-sfx/castle": {
      "type": "single",
      "url": "/audio-halloween/castle.mp3"
    },
    "poi-category-sfx/prison": {
      "type": "single",
      "url": "/audio-halloween/prison.mp3"
    },
    "poi-category-sfx/pharmacy": {
      "type": "single",
      "url": "/audio-halloween/pharmacy.mp3"
    },
    "poi-category-sfx/toilet": {
      "type": "single",
      "url": "/audio-halloween/toilet.mp3"
    },
    "poi-category-sfx/watermill": {
      "type": "single",
      "url": "/audio-halloween/watermill.mp3"
    },
    "halloween-ambient-sea": {
      "type": "single",
      "url": "/audio-halloween/halloween-ambient-sea.mp3"
    },
    "halloween-ambient-desert": {
      "type": "single",
      "url": "/audio-halloween/halloween-ambient-desert.mp3"
    },
    "halloween-ambient-forest": {
      "type": "single",
      "url": "/audio-halloween/halloween-ambient-forest.mp3"
    }
  },
  "sound-layers": [
    {
      "id": "halloween-area-bgm-switch-urban",
      "type": "bgm-state",
      "source": "halloween-ambient-night",
      "layout": {
        "sound-state-property": "unused"
      },
      "paint": {
        "sound-volume": 0.8,
        "sound-fade-duration": 2000
      }
    },
    {
      "id": "halloween-area-bgm-switch-sea",
      "type": "bgm-state",
      "source": "halloween-ambient-sea",
      "layout": {
        "sound-state-property": "unused"
      },
      "paint": {
        "sound-volume": 0.8,
        "sound-fade-duration": 2000
      }
    },
    {
      "id": "halloween-area-bgm-switch-desert",
      "type": "bgm-state",
      "source": "halloween-ambient-desert",
      "layout": {
        "sound-state-property": "unused"
      },
      "paint": {
        "sound-volume": 0.8,
        "sound-fade-duration": 2000
      }
    },
    {
      "id": "halloween-area-bgm-switch-forest",
      "type": "bgm-state",
      "source": "halloween-ambient-forest",
      "layout": {
        "sound-state-property": "unused"
      },
      "paint": {
        "sound-volume": 0.8,
        "sound-fade-duration": 2000
      }
    },
    {
      "id": "halloween-world-view-bgm-override",
      "type": "bgm-state",
      "source": "halloween-ambient-alt",
      "layout": {
        "sound-state-property": "unused"
      },
      "paint": {
        "sound-volume": 0.8,
        "sound-fade-duration": 2000
      }
    },
    {
      "id": "halloween-ping-cemetery",
      "type": "event",
      "source": "poi-category-sfx/cemetery",
      "target-layer": "halloween-poi-symbols",
      "filter": [
        "==",
        [
          "get",
          "category"
        ],
        "cemetery"
      ],
      "layout": {
        "sound-trigger": "click"
      },
      "paint": {
        "sound-volume": 0.6
      }
    },
    {
      "id": "halloween-ping-haunted-mansion",
      "type": "event",
      "source": "poi-category-sfx/woman-scream",
      "target-layer": "halloween-poi-symbols",
      "filter": [
        "==",
        [
          "get",
          "category"
        ],
        "haunted-mansion"
      ],
      "layout": {
        "sound-trigger": "click"
      },
      "paint": {
        "sound-volume": 0.45
      }
    },
    {
      "id": "halloween-ping-witch-shop",
      "type": "event",
      "source": "poi-category-sfx/woman-scream",
      "target-layer": "halloween-poi-symbols",
      "filter": [
        "==",
        [
          "get",
          "category"
        ],
        "witch-shop"
      ],
      "layout": {
        "sound-trigger": "click"
      },
      "paint": {
        "sound-volume": 0.6
      }
    },
    {
      "id": "halloween-ping-church",
      "type": "event",
      "source": "poi-category-sfx/woman-scream",
      "target-layer": "halloween-poi-symbols",
      "filter": [
        "==",
        [
          "get",
          "category"
        ],
        "church"
      ],
      "layout": {
        "sound-trigger": "click"
      },
      "paint": {
        "sound-volume": 0.6
      }
    },
    {
      "id": "halloween-ping-monument",
      "type": "event",
      "source": "poi-category-sfx/woman-scream",
      "target-layer": "halloween-poi-symbols",
      "filter": [
        "==",
        [
          "get",
          "category"
        ],
        "monument"
      ],
      "layout": {
        "sound-trigger": "click"
      },
      "paint": {
        "sound-volume": 0.6
      }
    },
    {
      "id": "halloween-ping-info-booth",
      "type": "event",
      "source": "poi-category-sfx/woman-scream",
      "target-layer": "halloween-poi-symbols",
      "filter": [
        "==",
        [
          "get",
          "category"
        ],
        "info-booth"
      ],
      "layout": {
        "sound-trigger": "click"
      },
      "paint": {
        "sound-volume": 0.6
      }
    },
    {
      "id": "halloween-ping-real-cemetery",
      "type": "event",
      "source": "poi-category-sfx/cemetery",
      "target-featureset": {
        "featuresetId": "poi",
        "importId": "basemap"
      },
      "filter": [
        "==",
        [
          "get",
          "maki"
        ],
        "cemetery"
      ],
      "layout": {
        "sound-trigger": "click"